{
  "schema_version": 2,
  "snapshot_date_tpe": "2026-10-14",
  "generated_at_tpe": "2026-10-14T20:35:46.566510+08:00",
  "update_mode": "smart",
  "macro_backend": "official-free-v1",
  "official_macro_ready": true,
  "event_count": 5,
  "source_health": {
    "jp_boj": true,
    "jp_esri": true,
    "jp_stat": true,
    "kr_bok": true,
    "kr_mods": true,
    "tw_cbc": true,
    "tw_dgbas": true,
    "us_bea": true,
    "us_bls": true,
    "us_census": true,
    "us_census_housing": true,
    "us_census_m3": true,
    "us_dol": true,
    "us_fed": true,
    "us_fed_chair": true,
    "us_fed_g17": true,
    "us_ism": true
  },
  "provider_counts": {
    "official-us-bls-cpi": 1,
    "official-us-bls-ppi": 1,
    "official-us-census-housing": 1,
    "official-us-dol-claims": 1,
    "official-us-fed-g17": 1
  },
  "events": [
    {
      "event_id": "official-us-bls-cpi-2026-10-14",
      "time_tpe": "2026-10-14T20:30:00+08:00",
      "title": "美國消費者物價指數（CPI）",
      "category": "總體經濟",
      "importance": 3,
      "tier": "S",
      "country": "美國",
      "market_tags": [
        "美國",
        "通膨",
        "Fed",
        "NASDAQ",
        "台指"
      ],
      "actual": "3.7%",
      "forecast": "",
      "previous": "3.4%",
      "source": "U.S. Bureau of Labor Statistics (BLS)",
      "source_url": "https://www.bls.gov/schedule/news_release/cpi.htm",
      "status": "released",
      "expects_result": true,
      "provider": "official-us-bls-cpi",
      "symbol": "",
      "metrics": [
        {
          "metric_id": "headline_yoy",
          "label": "Headline YoY",
          "actual": "3.7%",
          "forecast": "",
          "previous": "3.4%",
          "unit": "%",
          "is_primary": true,
          "source_series": "CUUR0000SA0"
        },
        {
          "metric_id": "headline_mom",
          "label": "Headline MoM",
          "actual": "0.6%",
          "forecast": "",
          "previous": "0.4%",
          "unit": "%",
          "is_primary": false,
          "source_series": "CUSR0000SA0"
        },
        {
          "metric_id": "core_yoy",
          "label": "Core YoY",
          "actual": "2.6%",
          "forecast": "",
          "previous": "2.4%",
          "unit": "%",
          "is_primary": false,
          "source_series": "CUUR0000SA0L1E"
        },
        {
          "metric_id": "core_mom",
          "label": "Core MoM",
          "actual": "0.3%",
          "forecast": "",
          "previous": "0.3%",
          "unit": "%",
          "is_primary": false,
          "source_series": "CUSR0000SA0L1E"
        }
      ]
    },
    {
      "event_id": "official-us-bls-ppi-2026-10-15",
      "time_tpe": "2026-10-15T20:30:00+08:00",
      "title": "美國生產者物價指數（PPI）",
      "category": "總體經濟",
      "importance": 3,
      "tier": "S",
      "country": "美國",
      "market_tags": [
        "美國",
        "PPI",
        "通膨",
        "Fed",
        "NASDAQ",
        "台指"
      ],
      "actual": "",
      "forecast": "",
      "previous": "5.4%",
      "source": "U.S. Bureau of Labor Statistics (BLS)",
      "source_url": "https://www.bls.gov/schedule/news_release/ppi.htm",
      "status": "scheduled",
      "expects_result": true,
      "provider": "official-us-bls-ppi",
      "symbol": "",
      "metrics": [
        {
          "metric_id": "headline_yoy",
          "label": "Final Demand YoY",
          "actual": "",
          "forecast": "",
          "previous": "5.4%",
          "unit": "%",
          "is_primary": true,
          "source_series": "WPUFD4"
        },
        {
          "metric_id": "headline_mom",
          "label": "Final Demand MoM",
          "actual": "",
          "forecast": "",
          "previous": "0.4%",
          "unit": "%",
          "is_primary": false,
          "source_series": "WPSFD4"
        },
        {
          "metric_id": "core_yoy",
          "label": "Core YoY（除食品/能源/貿易服務）",
          "actual": "",
          "forecast": "",
          "previous": "4.7%",
          "unit": "%",
          "is_primary": false,
          "source_series": "WPUFD49116"
        },
        {
          "metric_id": "core_mom",
          "label": "Core MoM（除食品/能源/貿易服務）",
          "actual": "",
          "forecast": "",
          "previous": "0.3%",
          "unit": "%",
          "is_primary": false,
          "source_series": "WPSFD49116"
        }
      ]
    },
    {
      "event_id": "official-us-dol-claims-2026-10-15",
      "time_tpe": "2026-10-15T20:30:00+08:00",
      "title": "美國初領失業救濟金人數（Initial Claims）",
      "category": "總體經濟",
      "importance": 3,
      "tier": "A",
      "country": "美國",
      "market_tags": [
        "美國",
        "初領失業救濟",
        "就業",
        "Fed",
        "美元"
      ],
      "actual": "",
      "forecast": "",
      "previous": "197K",
      "source": "U.S. Department of Labor (ETA)",
      "source_url": "https://www.dol.gov/newsroom/releases/eta",
      "status": "scheduled",
      "expects_result": true,
      "provider": "official-us-dol-claims",
      "symbol": "",
      "metrics": [
        {
          "metric_id": "initial_claims",
          "label": "初領失業救濟金",
          "actual": "",
          "forecast": "",
          "previous": "197K",
          "unit": "K",
          "is_primary": true,
          "source_series": "DOL UI Weekly Claims PDF"
        }
      ]
    },
    {
      "event_id": "official-us-fed-g17-2026-10-16",
      "time_tpe": "2026-10-16T21:15:00+08:00",
      "title": "美國工業生產與產能利用率（G.17）",
      "category": "總體經濟",
      "importance": 2,
      "tier": "B",
      "country": "美國",
      "market_tags": [
        "美國",
        "工業生產",
        "產能利用率",
        "景氣",
        "Fed"
      ],
      "actual": "",
      "forecast": "",
      "previous": "",
      "source": "Federal Reserve Board",
      "source_url": "https://www.federalreserve.gov/releases/g17/",
      "status": "scheduled",
      "expects_result": true,
      "provider": "official-us-fed-g17",
      "symbol": ""
    },
    {
      "event_id": "official-us-census-housing-2026-10-20",
      "time_tpe": "2026-10-20T20:30:00+08:00",
      "title": "美國新屋開工與建築許可（Housing Starts / Permits）",
      "category": "總體經濟",
      "importance": 2,
      "tier": "B",
      "country": "美國",
      "market_tags": [
        "美國",
        "房市",
        "新屋開工",
        "建築許可",
        "景氣",
        "利率"
      ],
      "actual": "",
      "forecast": "",
      "previous": "1.275M",
      "source": "U.S. Census Bureau / HUD",
      "source_url": "https://www.census.gov/construction/nrc/current/",
      "status": "scheduled",
      "expects_result": true,
      "provider": "official-us-census-housing",
      "symbol": "",
      "metrics": [
        {
          "metric_id": "housing_starts_saar",
          "label": "新屋開工 SAAR",
          "actual": "",
          "forecast": "",
          "previous": "1.275M",
          "unit": "annualized units",
          "is_primary": true,
          "source_series": "Census/HUD New Residential Construction"
        },
        {
          "metric_id": "building_permits_saar",
          "label": "建築許可 SAAR",
          "actual": "",
          "forecast": "",
          "previous": "1.394M",
          "unit": "annualized units",
          "is_primary": false,
          "source_series": "Census/HUD New Residential Construction"
        }
      ]
    }
  ]
}
